{
  "schema": "scpn.atlas-project-links.v1",
  "snapshot_at_utc": "2026-09-29T20:27:38.803310+00:00",
  "owner_group": "SCPN-REACTOR-SYSTEMS",
  "purpose": "source-pinned project citations; no registration or capability admission",
  "record_count": 54,
  "public_repository_source": {
    "snapshot": "sources/65970b560a5ab803013da45cbb70bfad9acd8c9029cdedc3e283e02d65d964a8.json",
    "sha256": "65970b560a5ab803013da45cbb70bfad9acd8c9029cdedc3e283e02d65d964a8"
  },
  "records": [
    {
      "project_id": "SCPN-ADS-CORE",
      "owner_group": "SCPN-REACTOR-SYSTEMS",
      "category": "fission_device",
      "source": {
        "file": "project-boundary.json",
        "git_commit": "7e2582bd6072751470449661ca5688ddaeec76ab",
        "sha256": "20ac09d95cb447b7748454de40bdb89d3f6d1d27ed5e69dff6275b223062c5ff",
        "snapshot": "sources/20ac09d95cb447b7748454de40bdb89d3f6d1d27ed5e69dff6275b223062c5ff.json"
      },
      "configurations": [],
      "proposed_configuration_id": "scpn.reactor_systems:accelerator_driven_system",
      "source_declared_maturity": "architecture_only",
      "boundary_registration_state": "not_registered",
      "public_repository": null,
      "technical_validation": "not_assessed_by_atlas",
      "control_authority": false
    },
    {
      "project_id": "SCPN-BEAM-TARGET-CORE",
      "owner_group": "SCPN-REACTOR-SYSTEMS",
      "category": "device",
      "source": {
        "file": "reactor-domain.json",
        "git_commit": "63633923ff92b33771159b82a90dc2e39307c064",
        "sha256": "ab5dc0585f94b376266ad3bfb0ab5f151f4a6f8a51df77d37fd4ea440db42d15",
        "snapshot": "sources/ab5dc0585f94b376266ad3bfb0ab5f151f4a6f8a51df77d37fd4ea440db42d15.json"
      },
      "configurations": [
        "beam_target",
        "colliding_beam"
      ],
      "proposed_configuration_id": null,
      "source_declared_maturity": "computational_prototype",
      "boundary_registration_state": null,
      "public_repository": {
        "url": "https://github.com/anulum/scpn-beam-target-core",
        "retrieved": "2026-09-27",
        "source_snapshot_sha256": "65970b560a5ab803013da45cbb70bfad9acd8c9029cdedc3e283e02d65d964a8"
      },
      "technical_validation": "not_assessed_by_atlas",
      "control_authority": false
    },
    {
      "project_id": "SCPN-BIOCHEM-CORE",
      "owner_group": "SCPN-REACTOR-SYSTEMS",
      "category": "chemical_device",
      "source": {
        "file": "project-boundary.json",
        "git_commit": "510da404352f6c424b68611fec7a15c9069eb890",
        "sha256": "5dc514ed935b709a52a33282d8ebcc479964db7a2ddc1bed1d9bd6925159e86f",
        "snapshot": "sources/5dc514ed935b709a52a33282d8ebcc479964db7a2ddc1bed1d9bd6925159e86f.json"
      },
      "configurations": [],
      "proposed_configuration_id": "scpn.reactor_systems:biochemical_reactor",
      "source_declared_maturity": "architecture_only",
      "boundary_registration_state": "not_registered",
      "public_repository": null,
      "technical_validation": "not_assessed_by_atlas",
      "control_authority": false
    },
    {
      "project_id": "SCPN-BREED-BURN-CORE",
      "owner_group": "SCPN-REACTOR-SYSTEMS",
      "category": "fission_device",
      "source": {
        "file": "project-boundary.json",
        "git_commit": "c43a70489af6581f4d3aef80f54fe74534b63547",
        "sha256": "1d25981fc008a9d1d000433e238351f00831be992d9544942db89b2c7818b6eb",
        "snapshot": "sources/1d25981fc008a9d1d000433e238351f00831be992d9544942db89b2c7818b6eb.json"
      },
      "configurations": [],
      "proposed_configuration_id": "scpn.reactor_systems:breed_and_burn_reactor",
      "source_declared_maturity": "architecture_only",
      "boundary_registration_state": "not_registered",
      "public_repository": null,
      "technical_validation": "not_assessed_by_atlas",
      "control_authority": false
    },
    {
      "project_id": "SCPN-BWR-CORE",
      "owner_group": "SCPN-REACTOR-SYSTEMS",
      "category": "fission_device",
      "source": {
        "file": "project-boundary.json",
        "git_commit": "3c236c3715d43c2df859415308959b853f5cf465",
        "sha256": "6a72f3c6a7b08c23c0f57639623af98e5d6116f5fdc7132c550b6b28cb2bf594",
        "snapshot": "sources/6a72f3c6a7b08c23c0f57639623af98e5d6116f5fdc7132c550b6b28cb2bf594.json"
      },
      "configurations": [],
      "proposed_configuration_id": "scpn.reactor_systems:boiling_water_reactor",
      "source_declared_maturity": "architecture_only",
      "boundary_registration_state": "not_registered",
      "public_repository": null,
      "technical_validation": "not_assessed_by_atlas",
      "control_authority": false
    },
    {
      "project_id": "SCPN-CATALYTIC-BED-CORE",
      "owner_group": "SCPN-REACTOR-SYSTEMS",
      "category": "chemical_device",
      "source": {
        "file": "project-boundary.json",
        "git_commit": "e343b7ea6b67fe11f5d4f97008f77743d7cb9ff0",
        "sha256": "edae47ba9053b2d3ac3a9141dd3400777c9c2129cefaedb9397796cf3670d075",
        "snapshot": "sources/edae47ba9053b2d3ac3a9141dd3400777c9c2129cefaedb9397796cf3670d075.json"
      },
      "configurations": [],
      "proposed_configuration_id": "scpn.reactor_systems:catalytic_fixed_bed_reactor",
      "source_declared_maturity": "architecture_only",
      "boundary_registration_state": "not_registered",
      "public_repository": null,
      "technical_validation": "not_assessed_by_atlas",
      "control_authority": false
    },
    {
      "project_id": "SCPN-CHANNEL-CORE",
      "owner_group": "SCPN-REACTOR-SYSTEMS",
      "category": "fission_device",
      "source": {
        "file": "project-boundary.json",
        "git_commit": "dcc1606b5b3fc5fead561e655d29568f8ec33ef1",
        "sha256": "46ecbb34831c0765218dc0cbac4628171b793614f84cfbe70447d4a54d181244",
        "snapshot": "sources/46ecbb34831c0765218dc0cbac4628171b793614f84cfbe70447d4a54d181244.json"
      },
      "configurations": [],
      "proposed_configuration_id": "scpn.reactor_systems:channel_type_graphite_reactor",
      "source_declared_maturity": "architecture_only",
      "boundary_registration_state": "not_registered",
      "public_repository": null,
      "technical_validation": "not_assessed_by_atlas",
      "control_authority": false
    },
    {
      "project_id": "SCPN-CHEM-KINETICS-CORE",
      "owner_group": "SCPN-REACTOR-SYSTEMS",
      "category": "chemical_device",
      "source": {
        "file": "project-boundary.json",
        "git_commit": "40e16d11f470ffe5ec16e9348e285640f2c4d31d",
        "sha256": "89af7960eb0747637d50674f73865e4907b3b34f715126fe23ebeacac42bc819",
        "snapshot": "sources/89af7960eb0747637d50674f73865e4907b3b34f715126fe23ebeacac42bc819.json"
      },
      "configurations": [],
      "proposed_configuration_id": "scpn.reactor_systems:ideal_gas_chemical_reactor",
      "source_declared_maturity": "architecture_only",
      "boundary_registration_state": "not_registered",
      "public_repository": null,
      "technical_validation": "not_assessed_by_atlas",
      "control_authority": false
    },
    {
      "project_id": "SCPN-CHEM-PROCESS-HYBRID-CORE",
      "owner_group": "SCPN-REACTOR-SYSTEMS",
      "category": "hybrid_composition",
      "source": {
        "file": "project-boundary.json",
        "git_commit": "3b990422499fff76c36c8064b6ef33d9cefa424a",
        "sha256": "1ecb3c1e1c96ff0ac8581337ef9f5d1737eb18e925c1e29b8d32c38743b16f5b",
        "snapshot": "sources/1ecb3c1e1c96ff0ac8581337ef9f5d1737eb18e925c1e29b8d32c38743b16f5b.json"
      },
      "configurations": [],
      "proposed_configuration_id": null,
      "source_declared_maturity": "architecture_only",
      "boundary_registration_state": "not_registered",
      "public_repository": null,
      "technical_validation": "not_assessed_by_atlas",
      "control_authority": false
    },
    {
      "project_id": "SCPN-DENSE-PLASMA-FOCUS-CORE",
      "owner_group": "SCPN-REACTOR-SYSTEMS",
      "category": "device",
      "source": {
        "file": "reactor-domain.json",
        "git_commit": "f0dc6650442167988f67b6151ffa50713e0d0e6b",
        "sha256": "7e20123ee608d39bfd74bf2f035ef8f404e95b6a95c91ea3755487891f704615",
        "snapshot": "sources/7e20123ee608d39bfd74bf2f035ef8f404e95b6a95c91ea3755487891f704615.json"
      },
      "configurations": [
        "dense_plasma_focus"
      ],
      "proposed_configuration_id": null,
      "source_declared_maturity": "computational_prototype",
      "boundary_registration_state": null,
      "public_repository": {
        "url": "https://github.com/anulum/scpn-dense-plasma-focus-core",
        "retrieved": "2026-09-27",
        "source_snapshot_sha256": "65970b560a5ab803013da45cbb70bfad9acd8c9029cdedc3e283e02d65d964a8"
      },
      "technical_validation": "not_assessed_by_atlas",
      "control_authority": false
    },
    {
      "project_id": "SCPN-ELECTROCHEM-CORE",
      "owner_group": "SCPN-REACTOR-SYSTEMS",
      "category": "chemical_device",
      "source": {
        "file": "project-boundary.json",
        "git_commit": "e130c7abf7a845ee5b5f9fb35714c54eeeee2c68",
        "sha256": "577d59a0521b4bcce05e5a89701087a15ccaa633ab90aba863fe0f7604d7d244",
        "snapshot": "sources/577d59a0521b4bcce05e5a89701087a15ccaa633ab90aba863fe0f7604d7d244.json"
      },
      "configurations": [],
      "proposed_configuration_id": "scpn.reactor_systems:electrochemical_reactor",
      "source_declared_maturity": "architecture_only",
      "boundary_registration_state": "not_registered",
      "public_repository": null,
      "technical_validation": "not_assessed_by_atlas",
      "control_authority": false
    },
    {
      "project_id": "SCPN-FRC-CORE",
      "owner_group": "SCPN-REACTOR-SYSTEMS",
      "category": "device",
      "source": {
        "file": "reactor-domain.json",
        "git_commit": "defa4abc11156d9958c2dd0b9b12633d714367d4",
        "sha256": "7809ba75080ad923ed5364cc1b526ed193d70bab1ec45cc95eb25f4d01c0ca30",